Author-作者,Title-题名,Source-刊名,Year-年,Roll-卷,Period-期,PageCount-页码
赵文忠;,工会加强维权能力建设的几点建议,现代经济信息,2013,,10,"""123"""
闫林;,新时期如何推进企业工会工作,现代经济信息,2013,,10,"""66"""
璩梅宵;,引入谈判机制与建立产业工会是强化工会维权能力之保证,中国科技投资,2013,,14,"""221-222"""
袁明汉;王翠英;,三十三团工会“四位一体”维权帮扶职工,兵团工运,2013,,4,"""50"""
魏聪;张明远;,关于创业农场工会数字化维权模式的实践探索,中国劳动关系学院学报,2013,,2,"""47-49"""
伍朝阳;,广西柳工集团有限公司工会 加强法援服务 提升维权水平,工会博览,2013,,4,"""37"""
李建楠;杨国敬;,工会维权的拓荒牛——记河南莲花味精股份有限公司工会委员会主任王峰,中国工会财会,2013,,3,"""34-35"""
韩凤;,新形势下如何搞好群众安全工作,工会信息,2013,,4,"""31-33"""
钱建朝;顾国华;,靖江市总工会开通3+X网络调解视频,工会信息,2013,,4,"""36"""
刘华政;,为职工维权:工会参与高校管理和服务的着力点——以思想政治工作的有效开展为视角,广西教育学院学报,2013,,1,"""95-98"""
,多措并举解决农民工工资拖欠问题,中国工运,2013,,2,"""60"""
Barbara Cherry;Susan R.Jacob;邹艳辉;,《现代护理学》之护士维权及当今工作场所的集体谈判和工会(上),当代护士(上旬刊),2013,,2,"""28-29"""
李艮坤;,艰辛维权路 工会帮解难——云梦县总工会为一工亡农民工家属维权实录,工友,2013,,1,"""28-29"""
玉茗;,真心维权热情服务—访中国工会“十六大”代表、青岛市总工会主席于睿,现代企业文化(上旬),2013,,12,"""29"""
李卫峰;,如何推进新形势下县级工会工作,工会信息,2013,,24,"""22-23"""
开宝;,来自远方的求助——滇、豫两地工会联动维权记事,时代风采,2013,,12,"""26"""
王志勤;,以职工服务中心为主体加强“大关爱”体系建设,中国职工教育,2013,,23,"""67"""
刘先祝;杨波;,宣汉县流动工会为异地遭车祸教师维权,工会信息,2013,,23,"""45"""
崔欣;万玉藻;,刘永发给职工一个能撑腰的娘家,工会博览,2013,,12,"""17-19"""
任礼斌;,盐业改制企业劳资关系面临的现状与思考,中国井矿盐,2013,,6,"""35-37"""
樊曦;林红梅;齐中熙;韩乔;,“舒心工作”离3亿多职工有多远?——工会主席与职工关于新时期维权的对话,时代风采,2013,,11,"""26-27"""
唐鑛;汪鑫;,关于构建和谐劳动关系的几点思考,工会博览,2013,,11,"""33-34"""
徐建辉;,试论供电企业工会工作创新,中华民居(下旬刊),2013,,10,"""199-200"""
张建军;刘兴攀;,80后矿工异乡遇难 保康工会千里助维权,工友,2013,,10,"""20-21"""
丁越兰;周莉;,中国企业员工体面劳动感知的结构研究,统计与信息论坛,2013,,10,"""107-112"""
金谷;,谈基层工会财务集中化管理,北京市工会干部学院学报,2013,,3,"""19-21"""
孙亚涛;,浅谈国有企业工会工作存在的问题及对策,人力资源管理,2013,,9,"""135"""
耿忠萍;,浅议高校工会为女教职工维权的问题,管理观察,2013,,25,"""130-131"""
王乐雷;,我国高校工会体系建设中的新问题及建议,内蒙古教育(职教版),2013,,8,"""7-8"""
许仲良;,新时期国有企业工会工作存在的问题与对策,中国职工教育,2013,,16,"""18"""
仇翠萍;,完善职工利益诉求表达机制的若干思考,工会理论研究(上海工会管理职业学院学报),2013,,4,"""39-40"""
王兰印;,浅谈当前国有企业工会工作面临的问题与对策,价值工程,2013,,21,"""197-198"""
李明桂;,马克思恩格斯工会思想于人的发展的现实意蕴,改革与战略,2013,,7,"""1-6"""
黄媚珍;,推进女职工权益保护专项集体合同工作,中国工运,2013,,7,"""44-45"""
陈忠义;,构建责任体系维护职工权益,现代企业文化(上旬),2013,,7,"""80-81"""
陈建中;,浅论船闸应急保障中心工会工作的创新,中国职工教育,2013,,12,"""95"""
骆筱芸;,在职工维权路上工会组织如何发挥更好的作用,东方企业文化,2013,,11,"""20"""
,崇尚公益的法律人,中国职工教育,2013,,11,"""15+17"""
吴松平;,非公企业工会应如何开展维权工作?,中国职工教育,2013,,11,"""22"""
曹旭峰;萧辉民;,英山县工会为精神病母子千里维权,工友,2013,,5,"""25"""
程冬梅;,国有企业工会工作面临的问题及对策研究,中外企业家,2013,,13,"""148-149"""
,郑州市教科文卫体工会开展劳务派遣工维权调研,工会信息,2013,,8,"""41"""
涂永珍;,党委政府创新维稳机制应注重发挥工会的维权功能,领导科学,2013,,11,"""12-14"""
时静娟;,"落实企业工会工作,切实维护员工利益",改革与开放,2013,,6,"""60"""
刘光宇;,浅谈工会证明义务的缺失,北京市工会干部学院学报,2013,,1,"""45-48"""
盛红升;,论工会组织为女职工维权工作,才智,2013,,7,"""220"""
Barbara Cherry;Susan R. Jacob;邹艳辉;,《现代护理学》之护士维权及当今工作场所的集体谈判和工会(下),当代护士(上旬刊),2013,,3,"""27-28+30"""
晏承芹;,新形势下企业工会工作面临的新问题与对策探讨,重庆电力高等专科学校学报,2013,,1,"""45-47"""
胥明虎;,徐州市总工会开展“文化共建边疆行”活动,工会信息,2013,,4,"""41"""
崔卫兵;,浅析如何做好企业工会工作,新西部(理论版),2013,,Z1,"""89+97"""
,强化法律援助服务 构建和谐劳动关系,工会信息,2013,,2,"""25-27"""
董小龙;,工会组织推进和谐企业创建的任务探索,决策探索(下半月),2013,,12,77
顾玉琴;,创新完善镇级工会组织体制 选优配强镇级工会干部队伍,工会信息,2013,,24,6月7日
李德志;,创新工会服务意识 维护职工合法权益,中国煤炭工业,2013,,12,70-71
冯敏良;,高校工会的社会工作介入研究,北京工业大学学报(社会科学版),2013,,6,35-39
吴大刚;,工会务实创新的带头人,中国职工教育,2013,,23,66
吴亚平;郑桥;,中国特色社会主义工会发展道路探析,新视野,2013,,6,83-86
郭稳才;,运用法治思维和法治方式推进工会工作——学习贯彻中国工会十六大精神的体会,工会信息,2013,,21,43-45
柳东;金星彤;,我国工会现状与原因阐析,学理论,2013,,28,142-143
张锐;孙文;,丰富保障内涵 确保“切实维权”,中国职工教育,2013,,19,44
郑雪芹;,企业工会财务管理实践与思考,现代商业,2013,,26,216
杨宏业;,创新打造工会服务文化,当代电力文化,2013,,3,75-77
唐猛;王晓华;,完善机制 突出重点 创新维权——宜宾市翠屏区总工会谱写职工维权服务新篇章,四川劳动保障,2013,,9,34+49
罗建强;,扎实开展工会工作 构建企业和谐劳动关系,东方企业文化,2013,,16,36-37
阎雯;闫光照;龚云;,南漳县总工会为农民工维权纪实,工友,2013,,8,26-27
吴大刚;,刘良:务实创新的工会带头人,工会信息,2013,,16,8
薛丁齐;,在学习和实践中建设五型工会,中国劳动关系学院学报,2013,,4,44-48
王勇;,论工会女工工作创新,东方企业文化,2013,,14,23-24
梁洁仪;,关于切实做好工会工作的几点建议,东方企业文化,2013,,14,69
招永雄;,加强工会经费使用的质量管理,中国工会财会,2013,,7,13-14
,寿光市总工会畅通职工法律援助“绿色通道”,工会信息,2013,,13,43-44
张琼;,国有企业工会开展思想政治工作刍议,新西部(理论版),2013,,12,64+63
申毅;,工会建设上的“三个着力”、“四个把握”与“四个必须”,天津市工会管理干部学院学报,2013,,2,14-16
吴长安;,浅析工会组织在企业发展中的作用,东方企业文化,2013,,12,23-24
龚钰淋;,工会参与基层劳动争议调解机制研究,北京市工会干部学院学报,2013,,2,39-42
,上海大屯能源股份有限公司工会,工会理论研究(上海工会管理职业学院学报),2013,,3,50-51
张宝权;张冀昌;,劳动者驿站——工会工作社会化的平台———洛阳市总工会推动工会工作社会化实践探索,工会信息,2013,,11,22-23
马晋宇;,论工会推进和谐劳动关系建设的两个重要问题,工会论坛(山东省工会管理干部学院学报),2013,,3,1月3日
梁华锦;,浅议新形势下如何做好国有企业工会工作,东方企业文化,2013,,10,19-20
阳万雄;,发挥中国工会的特色 切实维护职工合法权益,中国职工教育,2013,,8,4月5日
付倩;,浅议如何加强基层工会建设,企业研究,2013,,8,166
徐汇区总工会课题组;袁建村;,关于政务微博在扩大工会工作影响力方面的作用初探,工会理论研究(上海工会管理职业学院学报),2013,,2,31-33
钟兵;,加强高校基层工会组织建设的思考,传奇.传记文学选刊(教学研究),2013,,3,54-55
李梅;,加强工资集体协商 促进企业和谐发展,中国职工教育,2013,,4,6月7日
蒲建华;卢祖展;刘长波;黄青良;,论劳务派遣员工的公平待遇与其团结权的关系,经济师,2013,,2,24-26+29
黄伟;,对新形势下高校工会工作重心的思考,科协论坛(下半月),2013,,1,180-181
张振亚;,围绕中心 服务职工 推进法律援助工作再上新台阶,兵团工运,2013,,1,11
刘佳;,创新帮扶工作模式 推进和谐社会建设,兵团工运,2013,,1,40
朱勋克;,工会社会工作的核心要务及发展策略,理论与改革,2013,,1,110-113
赵星权;,充分发挥企业工会经审会作用,中国工运,2013,,1,47-48
高定才;,对主动维权、依法维权、科学维权的认识和研究,经营管理者,2013,,1,273
原会建;,制度环境变迁下国有企业工会转型及其困境,中国行政管理,2013,,1,64-67
孟雅琳;,发挥工会在和谐劳动关系建设中的职能,当代电力文化,2013,,5,"""62-64"""
孙莉;,和谐劳资关系视域下工会的法律地位构建,东方企业文化,2013,,24,31-32
鲁萍;李瑞芳;,高校后勤非在编员工权益维护及入会等相关问题研究——以对外经济贸易大学为调查对象,高校后勤研究,2013,,6,48-51
王仙友;,增强邮政储蓄银行基层工会活力的几点思考,企业家天地,2013,,12,19-20
,全国总工会与国际劳工组织联合举办企业劳动争议预防调解工作国际研讨会,工会信息,2013,,24,19
李虎;,九江市总工会加强帮扶服务站点建设,工会信息,2013,,24,46
李民;,新形势下企业工会工作的探讨与研究,山东工业技术,2013,,14,194
郑五妮;,提升工会干部整体素质 高效发挥服务职能,现代工业经济和信息化,2013,,24,42-43+51
郭华;,农民工劳资矛盾调节机制的创新研究,中国商贸,2013,,35,173-174
,沈阳公安3年为农民工讨薪近9亿元,人民公安,2013,,23,55
本刊编辑部;,深入学习宣传贯彻党的十八届三中全会精神是当前工会组织的重要政治任务,中国工运,2013,,12,1
王悦华;,在新的起点上推动工会工作创新发展,中国工运,2013,,12,7月8日
,习近平在同中华全国总工会新一届领导班子集体谈话时强调 把握我国工人运动的时代主题 为实现中国梦再创新业绩再建新功勋,中国职工教育,2013,,23,5
公晓红;,降低成本 提升技巧 增强活力,劳动保障世界,2013,,12,23
邹最东;,凝聚主人翁力量 发挥主力军作用,工会信息,2013,,23,23
赵相鑫;刘荣峰;丁宁;,泰安市总工会“双围绕”擦亮服务名片,工会信息,2013,,23,43
赵忠步;,徐州市铜山区总工会创新开展工资集体协商工作,工会信息,2013,,23,45
张维;,邯矿集团陶二煤矿“五加强”推进工资集体协商,工会信息,2013,,23,47
高臣岭;尹萌;,新时期企业工会工作的努力方向和着力点,中国高新技术企业,2013,,34,142-143
,服务职工助力企业——中铁二十二局集团公司工会成立九年回眸,工会博览,2013,,12,38
张威;,工会服务站职工的娘家,工会博览,2013,,12,36
赵霞;,开拓创新工会工作 为实现中国梦凝心聚力,改革与开放,2013,,22,95+55
任光新;,新经济形势下工会工作面临的问题及对策,山东工业技术,2013,,13,147
王娇萍;,全总党组中心组专题学习 习近平总书记在同全总新一届领导班子成员集体谈话时的重要讲话精神 坚持正确方向 勇于担当责任,中国职工教育,2013,,22,7
何景阳;,九台农商银行被中华全国总工会授予“全国模范职工之家”,吉林农业,2013,,11,102
段英;,新形势下加强企业工会工作的几点思考,东方企业文化,2013,,22,24-25
王立波;,浅谈如何加强企业基层工会工作方法,今日中国论坛,2013,,19,118-119
,厦门市总工会,福建理论学习,2013,,11,50
王嫔;,论新形势下如何做好国企工会女职工工作,企业科技与发展,2013,,Z2,77-79
胡素青;贺文明;,广东船员维权有门路,珠江水运,2013,,21,26
王巧红;,浅谈国有企业改革转型发展中如何发挥工会组织的作用,科学之友,2013,,11,38-39
,习近平在同中华全国总工会新一届领导班子集体谈话时强调 竭诚服务职工群众维护职工群众权益 为实现中国梦再创新业绩再建新功勋,兵团工运,2013,,11,4
林龙婷;,她是宜昌的“红”——记宜昌市西陵区西陵街道工会联合会副主席王红,工友,2013,,11,28-29
宋芸;,如何在创建和谐企业中充分发挥工会组织的积极作用,求实,2013,,S2,65-66
汪金兰;,刍议新形势下女职工维权工作的途径和方法,求实,2013,,S2,67-68
邓学冬;,新形势下的煤炭企业工会工作开展浅析,现代经济信息,2013,,21,81
郭新民;,认真践行党的群众路线 努力做好新时期工会工作,前进,2013,,11,7月9日
蒋玉林;,学习贯彻十六大精神 推动工会事业新发展,中国职工教育,2013,,21,30
杨波;,工会十五大以来达州工会工作回眸,中国工人,2013,,11,30-31
,广西工会唱响法律援助品牌,中国工会财会,2013,,11,38
曹绪红;,政府规制视角下的劳动关系探析,东岳论丛,2013,,11,158-161
陈元华;,即使亏损也要给职工涨工资,工会博览,2013,,11,29
何晓丹;,高职院校工会在创建和谐校园中的作用,江苏经贸职业技术学院学报,2013,,5,68-70
林平;,工会组织在实现“企业梦”中的重要作用,中国职工教育,2013,,20,4+6
洪萍;颜三忠;,试论全员聘任制背景下教师权益的工会保护,江西师范大学学报(哲学社会科学版),2013,,5,72-75+91
李惠芬;,孝昌县:以“四抓”促区域性工资集体协商,工友,2013,,10,40-41
刘玉萍;,房县总工会:为农民工提供全方位服务,工友,2013,,10,36-37
金华;郁建民;,当前高校工会工作面临的问题与思考,铜陵学院学报,2013,,5,82-83
,徐汇区总工会,工会理论研究(上海工会管理职业学院学报),2013,,5,4
刘金祥;戴国印;,金桥开发区化解群体性劳资矛盾的实践与探索,工会理论研究(上海工会管理职业学院学报),2013,,5,26-29
,创新超越——记中航工业西航工会“五新”实践之路,中国工运,2013,,10,25-26
,来稿摘登,中国工运,2013,,10,58-59
孟泉;,重塑工会与工人的关系——读《忧与思——三十年工会工作感悟》,中国工人,2013,,10,20-22
苏文帅;,社会化让工会道路越走越宽广,中国职工教育,2013,,19,45
臧铁柱;,源头参与 超前防范——江苏省总工会参与职业危害防治工作的模式,劳动保护,2013,,10,51-53
吴俊杰;,涟源市人大常委会主任会议聚焦《工会法》实施,工会信息,2013,,19,41
杨爽;施永敏;,医院工会规范化建设应适应医院发展的需要,基层医学论坛,2013,,28,3780-3781
李迪;,浅谈国企工会工作的创新思路,中国职工教育,2013,,18,15
崔金和;秦砖;,中国工会的五大优势,天津市工会管理干部学院学报,2013,,3,16-18
王安团;,以创新为动力进一步推进工会工作,东方企业文化,2013,,18,13-14
范韶华;,关于新形势下推进工资集体协商工作的思考,北京市工会干部学院学报,2013,,3,12月14日
赵礼忠;,围绕发展抓“建家” 抓好“建家”促发展——中国人保财险潍坊市分公司工会创建“全国模范职工之家”纪实,中国保险,2013,,9,35-36
张全安;,充分发挥职工在公司创新中的主力军作用,现代工业经济和信息化,2013,,18,16-17
赵勇;,培育学习型职工 创新工会工作,现代工业经济和信息化,2013,,18,20-21
陈德荣;,主动预防化解劳资纠纷 促进劳动关系和谐稳定,江南论坛,2013,,9,19-20
曾裕素;,探索基层工会干部职业化新途径——以重庆市九龙坡区总工会的实践为例,工会信息,2013,,18,25-26
卞永琳;,姜堰区“女职工关爱行动”频出新招,工会信息,2013,,18,35
李英明;,通城县总工会与县法院联合维权维稳,工会信息,2013,,18,41
胡瑾;,兵团开展《女职工劳动保护特别规定》知识竞赛活动,兵团工运,2013,,9,39
岳经纶;,在维权与维稳之间:中国劳动关系的困境与出路,探索与争鸣,2013,,9,47-52
方红梅;,浅谈在电力体制改革中必须坚持的原则,中国电力教育,2013,,23,157-158
刘文平;路鹏;,结合十八大精神对新时期发电企业工会工作的思考,中国电力教育,2013,,23,187-188
,信息动态,中国工运,2013,,9,60-63
张信俤;,改进非编职工工会工作 促进高校和谐发展,科技信息,2013,,25,158-159
苏矿生;段瑞敏;,服务大局构和谐 人本管理暖人心,中国职工教育,2013,,17,36
徐忠峰;,试论基层工会的作用发挥,办公室业务,2013,,17,211-212
汪涛;王仲明;,通城法院:多举措优化企业发展环境见实效,中国审判,2013,,9,41
臧志红;,“面心实”服务职工在基层,现代企业文化(上旬),2013,,9,84-85
韦柳红;韦贞笛;李耀侦;,开展职工医疗互助保障工作的思考与建议,中国工会财会,2013,,9,8月9日
,发挥职能作用 服务职工群众——创新发展中的江苏沛县工会,工会信息,2013,,17,2
,抚顺市总工会健全机制推动依法维权,工会信息,2013,,17,43-44
刘芸;,浅议如何做好新时期企业的工会工作,电子世界,2013,,16,233
李文娟;,化工企业工会工作面临的挑战与对策思考,科技风,2013,,16,248
佟群磊;,浅议工会组织在构建和谐型企业中的作用,科技视界,2013,,24,312
马红英;,促进企业发展和维护职工权益的辩证关系,中小企业管理与科技(下旬刊),2013,,8,39
聂艳萍;,浅析新时期企业工会工作,东方企业文化,2013,,16,59
平震;,对创建学习型工会组织的探索,东方企业文化,2013,,16,31-32
赵宏;徐鸿学;程慧竹;,石油科研工会组织开展劳动竞赛的探索,东方企业文化,2013,,16,48
常红霞;,改进工会工作服务职工群众的建议,今日科苑,2013,,16,85-86
李梅玉;,以科学发展观指导高校工会工作的若干探讨,教育教学论坛,2013,,34,12月13日
叶青青;,谈基层工会在构建和谐企业中的作用,冶金企业文化,2013,,4,48-49
罗志好;,完善困难职工帮扶机制 构建温馨和谐之家,建材发展导向,2013,,4,57-60
谢永彬;艾剑萍;,安康大道上的健行者——中铁五局机械化公司连续八年获全国“安康杯”竞赛优胜企业称号,企业文明,2013,,8,61-62
毛开云;,共筑“中国梦” 合力奏华章,工友,2013,,8,1
赵健杰;,创新:工会工作发展的不竭动力,工会信息,2013,,16,4月7日
,泰州市总工会建立企业职工维权工作站,工会信息,2013,,16,36-37
,达州市总工会推进法治达州建设活动,工会信息,2013,,16,39
余恒才;,"石泉县:侵权有人管,困难有人帮",工会信息,2013,,16,39
罗军;,岳阳市总工会“三举措”做强法律维权工作,工会信息,2013,,16,43
,积极参与社会管理 努力构建和谐劳动关系,中国工运,2013,,8,26-27
,工运短波,时代风采,2013,,8,31
王向民;,利益协调与社团整合:将工会建设成枢纽性社会组织的运行机制,工会理论研究(上海工会管理职业学院学报),2013,,4,10月13日
翟边;,上海工会管理职业学院干部培训中心工会干部教育培训近期新课推荐,工会理论研究(上海工会管理职业学院学报),2013,,4,48
,上海市建筑构件制品有限公司工会,工会理论研究(上海工会管理职业学院学报),2013,,4,50-51
,加强工会劳动保护工作的“三二一”监督检查体系,中国职工教育,2013,,15,19-20
昝舸;,煤矿农民工权益维护工作的思考——以砚北煤矿为例,发展,2013,,8,107
安洁;,"推进“两项工程”,创新女职工工作",经营管理者,2013,,18,101
刘学燕;,工会长效工作机制浅析,经济师,2013,,8,285-286
张正军;,如何在资源整合煤矿实现工会工作提升,企业导报,2013,,15,176
,郑煤集团工会建立健全服务职工工作体系,工会信息,2013,,15,46
张杰;,中铁八局电务公司“四抓”落实女工权益保护工作,工会信息,2013,,15,47
甄瑜;,西安市总成立全国首家工会职工纠纷人民调解委员会,工会信息,2013,,15,41
袁颖;,论工会工作创新的方法和途径研究,现代商业,2013,,21,114
胡燕燕;,企业工会工作之己见,科技与企业,2013,,14,19
轩晓芳;,新时期建设服务型工会的思考,河北企业,2013,,7,111-112
刘艳艳;,民营企业女工权益保障机制研究——基于亳州市部分药企的实证分析,长春工业大学学报(社会科学版),2013,,4,76-79
王元升;,同煤集团马脊梁矿民主管理工作调查及思考,科技信息,2013,,20,71
高飞;包月英;,促进农民工市民化的财政政策研究,产业与科技论坛,2013,,13,118-119
,民主管理助推企业法人治理结构进一步完善,工会信息,2013,,14,35-36
滕剑明;,余姚市总工会实施工会建设“领头雁”工程,工会信息,2013,,14,40
齐乃华;,诸城市总工会推动“三亮三百”活动,工会信息,2013,,14,45
李红卫;,现阶段中小企业工会组织责任的浅思考,才智,2013,,20,308-309
,开启企业工会发展新篇章——云南省人大常委会执行《云南省企业工会条例》执法检查活动速递,时代风采,2013,,7,4月6日
浦艳;,新劳动法下工会企业员工权益管理,现代经济信息,2013,,13,315+327
熊大康;,试论如何建设好职工之家,东方企业文化,2013,,13,300+287
宗萍;,塑造阳光心灵 助推民生幸福,中国职工教育,2013,,13,18-19
方敏;,"加强发挥工会职能,开创工会工作新局面",经营管理者,2013,,15,331
郝贵春;,浅谈煤矿工会维护权益关注企业民生的基本途径,办公室业务,2013,,13,243+245
黄克勤;,落实《劳动合同法》体现工会作为,中国水运,2013,,7,57
刘山茂;,试论有效推进企业工会工作创新发展,新西部(理论版),2013,,12,65
刘理凡;,以“三方机制”为视角的集体谈判权研究——以《武汉餐饮业工资专项集体合同》为例,法制与社会,2013,,18,83-84
天津市总工会研究室课题组;,关于提高维权实效促进企业和谐稳定的研究与思考,天津市工会管理干部学院学报,2013,,2,2月6日
孙荣华;,建筑施工企业基层工会工作思考,三峡大学学报(人文社会科学版),2013,,S1,25-27
丁允胜;,企业工会思想政治工作的几点思考,现代妇女(下旬),2013,,6,41
陈蓉;,新时期做好企业工会工作的思考,中小企业管理与科技(下旬刊),2013,,6,2
何勇;,浅谈新形势下企业工会的基本任务,才智,2013,,18,247
陈荣琳;,企业工会工作现状的调研分析及对策,中国职工教育,2013,,12,72
洪剑涛;,浅析工会工作在新形势下的创新开展,企业研究,2013,,12,174-175
蔡长海;,探索新时期国有企业工会在维护职工权益方面的思考,企业导报,2013,,12,52-53
奚启鸿;,采取措施抓好女工维权,兵团工运,2013,,6,47
张启航;,采取五项措施维护女职工权益,兵团工运,2013,,6,48
陈晖涛;卢红飚;,基于体面劳动的新生代农民工劳动权益保护,大连海事大学学报(社会科学版),2013,,3,72-75
丁龙嘉;蒋爱翠;,论王尽美群众观的确立、践行及其启示,理论学刊,2013,,6,22-25
朱骅;,企业工会创新职工之家建设的思考,市场周刊(理论研究),2013,,6,141-142
冯军;,坚持中国特色社会主义工会发展道路的成就与经验,北京市工会干部学院学报,2013,,2,4月6日
张孝梅;,试论新形势下的工会工作,北京市工会干部学院学报,2013,,2,11月13日
赵振良;,对企业民主管理工作创新发展的思考,人民公交,2013,,6,57-58
,宜宾县总工会完善维权机制,工会信息,2013,,12,45
金玉玲;,分析如何做好基层工会建设,中外企业家,2013,,16,237
新时期外资企业劳动竞赛工作研究课题组;王洪;汪琳;叶萌;,论外资企业的劳动竞赛与工会话语权,工会理论研究(上海工会管理职业学院学报),2013,,3,21-23
李军现;路爱萍;,“维权法律讲堂”为农民工增长法律知识,农村百事通,2013,,12,66
田喜荣;,在加快转型跨越、全面建成小康社会伟大实践中充分发挥工会作用,前进,2013,,6,4月6日
,职工权益的维护者——张勇赛,中国职工教育,2013,,11,18
周建权;,一篇迟到的“作业”——一张农民工工资欠条背后的思考,中国工人,2013,,6,26-29
曹艳;,要进一步改进和规范工会财务管理,中国工会财会,2013,,6,16-17
唐海军;,中铁二局创建首个标准化职(民)工服务站,工会信息,2013,,11,45
何花;,中国铁建十一局集团公司工会成立职工服务中心,工会信息,2013,,11,46
张锦清;,义乌市总工会强化劳动关系预警机制建设,工会信息,2013,,11,24
,泰州启动“阳光快车服务市区餐饮行业外来务工人员集中行动”,工会信息,2013,,11,40-41
