Author-作者,Title-题名,Source-刊名,Year-年,Roll-卷,Period-期,PageCount-页码
钟岩;,科学发展观是学校工会工作创新的灵魂,工会理论研究(上海工会管理职业学院学报),2009,,1,33-34
苏万生;,关于维护农民工合法权益的探索与思考,中国工运,2009,,2,58
石春燕;,绿叶对根的情谊——记兵团“屯垦戍边劳动奖章”获得者梁俊才,兵团工运,2009,,2,33
张红;,浅谈科学维权的若干问题,兵团工运,2009,,2,14
马静霞;,要切实提升工会组织的能力,兵团工运,2009,,2,20
罗华;,一三三团工会建两网设两站,兵团工运,2009,,2,45
朱茂林;,盘点:2008年十大劳动争议案,时代风采,2009,,2,22-26
鲍旭;,当前企业工会工作面临的问题及对策,企业家天地,2009,,2,24-25
张林;,以科学发展观为指导 创新企业工会工作,现代经济信息,2009,,3,64-65
谢武奇;,转型期企业政工的新思路,政工研究动态,2009,,Z1,55-56
,彰显新活力 展示新作为,中国职工教育,2009,,2,14
,学习实践科学发展观 推动平凉工会工作新局面,发展,2009,,2,12月13日
李承阳;,进一步完善工会经费税务代收工作的几点意见,中国工会财会,2009,,2,20-21
丁桂兰;芮小兰;高太梅;,当前高校妇女工作中存在的问题及对策研究,中国科技信息,2009,,3,156-157
易天;,全总着力推进“共同约定行动”,现代职业安全,2009,,2,43
李燕;,东城区总工会确定今年五项重点工作,工会博览,2009,,2,48
郭晶;穆永盛;,关于县区建立小行业工会的思考——以大连旅顺口区小行业工会组建工作为例,中国劳动关系学院学报,2009,,1,45-48
郭红民;,创新发展基层工会工作,中国劳动关系学院学报,2009,,1,49-51
王润秋;,充分发挥工会在基层民主中的作用,新西部(下半月),2009,,1,71-72
韩克庆;,社会流动视域中的农民工权益保护,河南大学学报(社会科学版),2009,,1,43-48
邵清;,发挥工会作用 构建和谐校园,新闻天地(论文版),2009,,1,94-95
苗笑寒;,以求真务实创新的精神统领工会工作,决策探索(下半月),2009,,1,72-73
施瑛;,强化工会职能 促进学院和谐发展,科学时代,2009,,2,151+114
李丹;,农民工维权问题分析,河南科技,2009,,1,13
张恒强;邵瑛;,台湾工会协调劳资关系对内地工会的启示,工友,2009,,1,44-45
张文涛;,构建和谐劳动关系 促进烟草和谐发展,黑龙江科技信息,2009,,2,136
陈群;,市级工会在市场经济体制下的工作模式,中国工运,2009,,1,39-41
卢东方;,当前企业工会工作面临的问题及对策,兵团工运,2009,,1,31
江巴吉才;,新年致辞,时代风采,2009,,1,1
,解放思想 创新发展 和谐共进——威海市总工会创新思路推进和谐发展纪实,中国职工教育,2009,,1,38-39
许慧玲;,打造服务平台 促进充分就业,群众,2009,,1,47-48
李京生;,深入学习实践科学发展观 推动工会财务工作的创新和发展,中国工会财会,2009,,1,16
李小琴;,延庆县政协委员听取县总工会维权工作汇报,工会博览,2009,,1,69
王颖;沈新立;,推动工会工作实现新跨越——访中共昌平区委副书记王书合,工会博览,2009,,1,12月13日
曹峰旗;曹文君;,列宁工会维权理论初探,毛泽东邓小平理论研究,2010,,12,"""55-59+82"""
朱江;王涛;,十堰工会维权之道,工友,2010,,12,"""14-16"""
单晶晶;,新形势下高校工会维权工作的思考,滁州学院学报,2010,,6,"""92-93"""
徐元俊;,试论社会转型后高校工会的维权——以湖南高职院校为例,云南财经大学学报(社会科学版),2010,,6,"""115-117"""
任国友;,中国工会维权机制探索研究,中国劳动关系学院学报,2010,,6,"""19-23"""
王德广;谭德福;郭穗;,教育工会组织维权工作特点与规律研究——以湖北省15所高校工会维权工作为例,三峡大学学报(人文社会科学版),2010,,6,"""104-107"""
陈淑妮;程英;孙娟;,基于劳动者认知角度的工会维权职能研究——以珠三角地区企业为例,深圳大学学报(人文社会科学版),2010,,6,"""85-90"""
林畅;徐江洪;,关于加强和完善高校工会维权职能的法律思考,湘潮(下半月),2010,,10,"""20-21"""
彭列汉;,高校工会维权困境与对策思考,学理论,2010,,29,"""259-261"""
陈晓宁;,高校劳动关系转型与工会维权模式创新,南京审计学院学报,2010,,4,"""52-56"""
谢安国;,现代大学制度下工会维权途径与机制探析,价值工程,2010,,29,"""186-187"""
汤雪峰;,如何有效开展高校工会的维权职能,安顺学院学报,2010,,5,"""71-73"""
蒋景坤;,践行中国特色社会主义工会维权观 促进和保障劳动者实现“体面劳动”,天津市工会管理干部学院学报,2010,,3,"""5-8"""
欧阳庆芳;何伟纲;,法律视角下高校工会维权的困境与突破,工会论坛(山东省工会管理干部学院学报),2010,,5,"""17-20"""
杨玉岭;,企业工会维权工作的思考,中国工运,2010,,9,"""47-48"""
梁玉秋;,"以科学发展观为指导,建立高校工会维权的长效机制",前沿,2010,,16,"""180-182"""
闻春梅;,工会维权撑起女性半边天,学习月刊,2010,,22,"""125"""
姚亚平;,充分发挥工会维权维稳作用 积极推进国有工业企业改革,中国工运,2010,,8,"""13-15"""
李双;高传智;,论媒介在工会维权中的作用及其实现,中国劳动关系学院学报,2010,,4,"""29-34"""
贲亚范;,工会维权的路径选择——关于当前企业工会维权工作的思考,中国劳动关系学院学报,2010,,4,"""35-37"""
刘天壮;,建筑企业工会维权工作之我见,工会论坛(山东省工会管理干部学院学报),2010,,4,"""6-7"""
许志;,我国高校工会维权的伦理思考,工会论坛(山东省工会管理干部学院学报),2010,,4,"""52-53+181"""
阎武;,从《工会法》看高校工会依法维权的途径,科教导刊(中旬刊),2010,,7,"""97-98"""
冯韬;,雪邦山下兰花香——云南金鼎锌业有限公司工会维权记事,时代风采,2010,,7,"""15-16"""
蔡伟伟;张红;,适应高校劳动关系新变化的工会维权创新机制,职业时空,2010,,6,"""13-14"""
何岩;,浅谈如何做好工会维权,商场现代化,2010,,13,"""175"""
彭坚;敖琴;,论和谐社会中我国工会维权职能的完善,法制与社会,2010,,12,"""256-257"""
胡汉平;,高校工会维权的特点和方法调查,湖北教育(领导科学论坛),2010,,2,"""78-79"""
杨子发;闫雪婷;陈生巧;,枝江:工会维权手段多,工友,2010,,2,"""24-25"""
訾媛媛;,高校工会维权难点及对策,科技信息,2010,,5,"""135-136"""
葛长敏;,高校劳动关系的变化与工会维权机制的创新,云南财经大学学报(社会科学版),2010,,1,"""119-120"""
王娜;,再论新时期高校工会的维权职能,工会论坛(山东省工会管理干部学院学报),2010,,1,"""60-61+104"""
炎夏;,“四项举措”保障基层工会维权,兵团工运,2010,,1,"""38"""
范建华;,现代管理理论热点问题研究——关于企业工会强化维权的思考,价值工程,2010,,35,"""93-94"""
张峻;,发挥工会组织在维护职工权益中的作用,邢台学院学报,2010,,4,"""10-12"""
吴海燕;,三十四团工会为务工人员维权,兵团工运,2010,,12,"""46"""
刘长胜;匡载舟;,切实发挥输出地工会在农民工异地维权中的积极作用,中国工运,2010,,12,"""27-28"""
闫山龙;,"新形势下县级工会发挥“维权维稳,助推转调”作用的思考",中国工运,2010,,12,"""44-45"""
,工会维权有位 融入中心有为,中国职工教育,2010,,12,"""65"""
欧阳骏;,工会有序维权是“普遍组建工会维护社会稳定”的关键,中国劳动关系学院学报,2010,,6,"""15-18"""
本刊编辑部;,切实履行工会维权基本职责 团结动员广大职工建功“十二五”,兵团工运,2010,,11,"""1"""
李军;,一四七团工会狠抓维权机制建设,兵团工运,2010,,11,"""51"""
李宏;,用科学发展观提升工会维权力,现代企业文化,2010,,11,"""94-95"""
,以“四化”建设助推工会维权工作,中国工运,2010,,11,"""40-41"""
韩伟利;,浅论工会组织依法维权的几个辩证关系,中小企业管理与科技(下旬刊),2010,,10,"""237"""
崔月云;,论工会的维权机制——从工会干部权益受侵害事件谈起,才智,2010,,29,"""211"""
赵宝岳;,《劳动合同法》对提高工会依法维权的思索,经营管理者,2010,,19,"""310+312"""
高海涛;蒋昭芒;罗星明;,博弈沃尔玛(下)一位中国基层工会主席维权路上的酸甜苦辣,中国工人,2010,,10,"""25-30"""
陈晓宁;,论三方机制下工会的角色定位,中国劳动关系学院学报,2010,,5,"""70-74"""
鲁银梭;范丹;,浙江省劳资关系协调机制的探索研究,中国劳动关系学院学报,2010,,5,"""35-40"""
孔一;,从同乡会到工会——农民工组织化维权的可能道路,法治研究,2010,,9,"""58-62"""
张庆娟;,企业工会女职工维权工作的加强与开展,经营管理者,2010,,17,"""201"""
杨君;李源;,对工会组织法治作用缺位的理性思考——以现实中因工伤维权不畅引发的恶性案件为线索,学术交流,2010,,9,"""72-75"""
庞慧敏;白先仪;,王远文:维权生涯 一位外企工会主席的不倦追求,当代劳模,2010,,4,"""43-50"""
朱学红;,做好维权档案工作 切实维护民工权益,浙江档案,2010,,8,"""17-18"""
高子斌;,煤炭企业工会维护职工合法权益的深度思考,工会论坛(山东省工会管理干部学院学报),2010,,4,"""43-44"""
汪赛男;,由富士康事件引发的法学思考,法制与社会,2010,,20,"""187"""
刘静;,浅议市场经济条件下企业工会的维权工作——以公路行业为例,科技创业月刊,2010,,7,"""91-92"""
秦剑军;,以人为本:高校工会维权工作的根本出发点和归宿,世纪桥,2010,,13,"""55-56"""
王钢生;,施工企业工会的重要职责:深化维权 促进稳定,中国职工教育,2010,,7,"""54-55"""
唐义满;,试探讨工会组织架构对维权职能的影响,科技信息,2010,,19,"""825-826"""
陈有德;,工会社会化维权模式的义乌实践,毛泽东邓小平理论研究,2010,,6,"""60-63"""
盛丽娟;,如何强化企业工会的维权职能,现代交际,2010,,6,"""86"""
刘瑞琴;,谈新形势下国有企业工会工作面临的问题及对策,商场现代化,2010,,17,"""17-18"""
肖巍;,组织起来 才能切实维权——论和谐稳定劳动关系的工会角色,毛泽东邓小平理论研究,2010,,5,"""29-33+85"""
李忠运;李睿祎;,2010年城际间工会就业维权联盟城市座谈会综述,中国工运,2010,,4,"""23-25"""
肖平容;,维权者被侵权的困境与进路新探——基于被开除的工会主席的思考,内江师范学院学报,2010,,3,"""37-41"""
王雁;,试论高校工会以人为本深度维权,兵团工运,2010,,3,"""13"""
董刚;,工会应该提前介入 协助职工依法维权,新财经,2010,,2,"""52-53"""
秦美从;秦中忠;,工会维权要有大局意识,中国劳动关系学院学报,2010,,1,"""15-17"""
袁明汉;王翠英;,三十三团工会“四位一体”维权帮扶职工,兵团工运,2010,,1,"""47"""
吴齐;,高校工会维权力探析,沈阳建筑大学学报(社会科学版),2010,,1,"""102-105"""
俞待花;,在和谐校园建设中高职院校工会发挥维权作用,科技创新导报,2010,,2,"""187"""
本刊编辑部;,本期导读,天津市工会管理干部学院学报,2010,,4,"""1"""
郭宇强;,论工会工作的主动性,天津市工会管理干部学院学报,2010,,4,"""11-13"""
熊虎;,保障职工民生 深化帮扶实效,中国工运,2010,,12,"""39"""
尚春霞;,提升工会在职业安全卫生中的维权作用,中国职工教育,2010,,12,"""14-15"""
苏世海;汪泓;刘倩;刘萍萍;,农民工维权的博弈论分析及农民工权益保护思考,安徽农业科学,2010,,33,"""19114-19117"""
娄景亭;,学会工会组织履行维权职能的原则,学会,2010,,11,"""42-44"""
常梅;,党政工齐抓共管 建“家”就是建企业,现代企业,2010,,10,"""44-45"""
,推动实现“两个普遍” 切实发挥乡镇工会作用,中国工运,2010,,10,"""9-10"""
陆明;,发挥工会在维护职工心理健康权益中的作用,北京市工会干部学院学报,2010,,3,"""23-26"""
全总基层组织建设部广西壮族自治区总工会桂林市总工会联合调查组;,一名主动依法科学维权的企业工会主席——关于英格索兰(桂林)工具有限公司工会主席王远文同志先进事迹的调查,中国工运,2010,,9,"""20-23"""
高海涛;蒋昭芒;罗星明;,博弈沃尔玛(上) 一位中国基层工会主席维权路上的酸甜苦辣,中国工人,2010,,9,"""37-44"""
白军平;,努力加强自身建设 充分发挥工会作用,新西部,2010,,8,"""60+52"""
赵红梅;,从“富士康事件”看我国劳动者权益保护机制的缺陷,法学,2010,,8,"""3-11"""
郭稳才;王英;,当前外商投资企业工会工作面临的突出问题和对策建议,中国工运,2010,,8,"""49-50"""
,中华全国总工会关于进一步加强企业工会工作充分发挥企业工会作用的决定,中国工运,2010,,8,"""18-20"""
,凝聚职工力量 助推科学发展,红旗文稿,2010,,15,"""42-43"""
,重点突出维权 切实履行服务职能——开发区总工会实现工会工作新突破,工会博览,2010,,8,"""50"""
陈星;,对新形势下企业工会工作思路的研究,科技创新导报,2010,,22,"""184"""
李磊;,中国工会软实力:内涵、问题及对策,理论与改革,2010,,4,"""78-82"""
杜长江;徐真彦;朱洪;,后金融危机时期工会如何为职工维权,四川党的建设(城市版),2010,,7,"""41"""
刘俊凯;,落实基本职责 做好维权工作,中小企业管理与科技(上旬刊),2010,,7,"""85-86"""
汪小立;,小热线 大情怀——来自潘兰英职工维权服务热线的故事,工友,2010,,6,"""30-31"""
张冬婷;,如何做好新形势下的女工工作,才智,2010,,15,"""226"""
刘爱兰;,现代大学制度架构下教代会的地位和作用,工会论坛(山东省工会管理干部学院学报),2010,,3,"""23-25"""
李璎;丁冠伟;,构建和谐企业的一项基础工程——徐汇区推进职代会制度建设的实践与思考,工会理论研究(上海工会管理职业学院学报),2010,,2,"""15-17"""
张燕彩;,与时俱进 不断创新企业工会工作新思路,现代经济信息,2010,,6,"""84-85"""
仝传良;,工会组织应在构建和谐企业中发挥积极作用,工会论坛(山东省工会管理干部学院学报),2010,,2,"""8-9"""
张丽;,以党的十七大精神为指导开创工会工作新局面,资治文摘(管理版),2010,,3,"""6"""
胡小娜;,工会履行依法维权的基本职责和措施,兵团工运,2010,,3,"""15"""
,围绕中心 推动创新 加强维权 提高服务 中国机冶建材工会四方面推进2010年工作,中国建材,2010,,3,"""82"""
于赞;,浅谈我国企业工会的维权职能,中小企业管理与科技(下旬刊),2010,,2,"""104"""
陈远芳;,坚持源头维护 全面维护 分层维护的有机统一,中国工运,2010,,2,"""19-20"""
李美琴;,创新高校工会工作的理论思考,工会论坛(山东省工会管理干部学院学报),2010,,1,"""64-65"""
,建立定向职工法律援助制度 完善工会依法维权工作机制,中国工运,2010,,1,"""31-32"""
孔慧娟;,浅析如何提高女工组织的维权意识,中小企业管理与科技(下旬刊),2010,,12,220
王炳起;,政府应充分发挥工会在调整利益分配格局中的作用,天津市工会管理干部学院学报,2010,,4,2月4日
吴京芬;,新时期企业工会工作的若干思考,中国电力教育,2010,,S2,32-34
刘广忠;,坚定信心 迎难而上 推动工会法律工作创新发展,中国职工教育,2010,,12,21-22
苍喆;陈凤华;,有一种精神叫“责任”——记全国劳动模范、中国工会十五大代表、大连·信阳(新县)进城务工人员工会联合会主席袁继斌,现代企业文化,2010,,11,62-63
吴亚平;,企业工会:劳动者权益的代表者和维护者——兼论工会组织体制改革的目标和方向,新视野,2010,,6,33-35
张玫瑰;王孟斐;,中美教育工会组织制度比较与研究,公民与法(法学版),2010,,9,62-64
罗卫革;,新时期建筑企业基层工会工作难点及对策研究,科技风,2010,,18,45+51
张原;陈建奇;,工会与行业劳动报酬的剪刀差悖论:基于中国数据的经验研究,经济评论,2010,,5,82-94
,月报,工会博览,2010,,9,31-33
齐杏发;,市场背景下中国传统工会转型的可能路径,华东经济管理,2010,,8,38-40
冯韬;,切切关爱显真情——师宗县总工会维权纪事,时代风采,2010,,8,12月13日
刘尔民;,以科学发展观为指导 全面提升工会工作创新水平,中国劳动关系学院学报,2010,,4,61-63
刘传文;,工会应在劳动争议调解中发挥重要作用,工会论坛(山东省工会管理干部学院学报),2010,,4,48
鲍卫东;,也从富士康事件谈中国的工会改革,全国商情(理论研究),2010,,13,43-44+63
吴亚平;,转型时期:工会面临的挑战与基本职责,中共浙江省委党校学报,2010,,4,8月12日
朱爱君;,基于党执政能力建设的高职院校工会作用发挥浅议,经济研究导刊,2010,,19,249-250
马梦砚;,强化自身组织建设充分发挥工会在构建和谐社会中的积极作用,新疆广播电视大学学报,2010,,2,54-57
魏春梅;,关于工会工作社会化的思考与实践,兵团工运,2010,,6,13
,依靠职工办好企业 促进企业和谐发展(上篇)——二商集团实现职工收入四年“翻一番”工作纪实,工会博览,2010,,6,57
李桂香;,在企业中如何发挥好工会大学校作用,经营管理者,2010,,10,306
王凌云;,自治区总工会到我区住房城乡建设系统调研,广西城镇建设,2010,,5,14
席小凤;,新形势下煤炭企业工会组织如何履行维护职能,现代企业,2010,,5,44-45
杨松;,谁为受伤的矿工讨说法——石屏县总工会维权纪实,时代风采,2010,,5,15-16
朱凤阁;,关于加强基层工会工作的几点思考,才智,2010,,13,23
中国劳动关系学院课题组;,全球化背景下中国工会发展道路的路径选择,中国特色社会主义研究,2010,,2,81-85
李金水;李绍平;,法律视域下高校用工制度的研究,理论界,2010,,4,213-215
欧阳皓;,"打造“四型”素质基础,开创工会工作新局",科技信息,2010,,10,55
祁军;,结合企业实际 创新工会工作,中国劳动关系学院学报,2010,,2,35-37
孟宪军;,创建学习型企业 打造高素质职工,天津市工会管理干部学院学报,2010,,1,28-31
牛满;,工会组织在国有企业改制中的作用,海峡科学,2010,,3,71-72
张朝香;,浅谈在创建劳动关系和谐企业如何发挥工会的作用,企业家天地下半月刊(理论版),2010,,3,21-22
李冬梅;,新时期工会干部要提高“五种能力”,兵团工运,2010,,2,15
本刊编辑部;简洁;,致读者,中国劳动关系学院学报,2010,,1,131
杨佩琴;,加强新时期非在编职工入会工作的思考,现代医院,2010,,1,125-127
开宝;冯韬;,不负职工所托——武定县总工会维权记事,时代风采,2010,,1,11月12日
,中国律师杂志社 中国律师网 联合推出 中国律师行业十件大事,中国律师,2010,,1,16-17
张秉涛;,新时期加强企业工会职能作用的探讨,科技促进发展,2010,,S1,230+228
邵文香;,在和谐企业创建活动中如何做好工会工作,科技促进发展,2010,,S1,276+274
李芳玉;,企业工会工作现状的调研分析及对策,中国新技术新产品,2010,,10,252
吴大耀;,坚持“四个到位”做好地税代收工作,中国工会财会,2010,,5,34
肖世平;,“五个创新 六个结合 六个到位”提升基层工会财务工作水平,中国工会财会,2010,,5,32-33
罗宝财;,完善工会财务资产监管机制,中国工会财会,2010,,5,6
张雯;,2009年省级政府与工会联席会议成效显著,中国工运,2010,,4,26-27
刘梅;,企业工会的重要课题:构建和谐企业工会工作机制,中国职工教育,2010,,4,62-63
,关于2009年省级工会上缴全总经费情况的通报,中国工会财会,2010,,4,7
陈永良;,在转变经济发展方式中 发挥工人阶级主力军作用,杭州(下旬刊),2010,,3,19
甄静慧;,曾飞洋:一个劳工NGO的夹缝生存,南风窗,2010,,6,66-68
马珲;,工会维护农民工权益问题初探,职业时空,2010,,3,24-25
仙居县委党校联合课题组;吴坚;,欠发达地区困难职工群体问题及其破解对策——基于县级工会的研究视域,北京市工会干部学院学报,2010,,1,8月12日
苏映红;,培育工人权利意识的必要性及其主要内容,北京市工会干部学院学报,2010,,1,13-16
刘丽臣;,服务型工会建设体现工会新作为,北京市工会干部学院学报,2010,,1,28-29
周寿成;,兖矿集团工会以“有为”谋“有位”,现代企业文化,2010,,3,82-83
郝丽琳;,科学发展观指导下的企业民主管理建设探微,市场论坛,2010,,3,36-37
,退休员工的医疗保险费怎样缴纳?,工友,2010,,3,45
张明;,贯彻党的群众路线 发挥工会职能作用,中国工运,2010,,3,27-28
郭稳才;王英;,关于全国工会推进“双措并举、二次覆盖”工作情况的调查,中国工运,2010,,3,29-30+34
杨杰;,建立健全“四个机制” 充分发挥乡镇、村工会“三个作用”,中国工运,2010,,3,37+39
孙玉杰;,构建和谐劳动关系 开展“共建共享”主题活动,中国工运,2010,,3,40-41
,来稿摘登,中国工运,2010,,3,59-60
,工运短波,时代风采,2010,,3,60-61
戴恒曙;,如何让行业报的“面孔”更亲切,新闻世界,2010,,3,21-22
董燕;,充分应用审计结果 提高经费监督效能,时代风采,2010,,3,58-59
赵爱学;叶少雄;许勇;,金融危机下职代会工作的实践与思考,武钢政工,2010,,3,33-35
杨秀春;,对煤矿安全监管的几点看法,中小企业管理与科技(上旬刊),2010,,3,201
,立足改革 盘活资产 推动工会企事业发展,中国工会财会,2010,,3,25-26
王颖;,为春天歌唱,工会博览,2010,,3,1
徐代珍;,新农村建设环境下的农民工转移探讨,当代教育理论与实践,2010,,1,68-71
胡秋丽;,对加强新时期多经企业工会工作的调查,理论学习与探索,2010,,1,39-40
文士;,农民工在哪里我们的服务就做到哪里,兵团工运,2010,,2,24
陈宗军;,南口农场工会扶贫帮困工作成效显著,兵团工运,2010,,2,41
本刊编辑部;,切实推动保障和改善民生政策的贯彻落实,中国工运,2010,,2,2
唐宝印;曹力;,中铁电气化局集团工会 贴近职工抓服务 突出特色创品牌,工会博览,2010,,2,59
陈鹏浩;,北京现代公司工会 职工“提素”为企业发展立新功,工会博览,2010,,2,65
,海淀园工会 拓宽工作领域 发挥工会协调作用,工会博览,2010,,2,67
赵家虎;,对新形势下基层工会工作创新发展的思考,中国劳动关系学院学报,2010,,1,93-95
郝永玥;,煤炭企业发挥工会“大学校”作用刍议,中国劳动关系学院学报,2010,,1,90-92
刘华敏;,试论加强工会自身能力建设,胜利油田党校学报,2010,,1,122-123
路洪霞;,在构建和谐企业中工会要发挥积极作用,工会论坛(山东省工会管理干部学院学报),2010,,1,6月7日
柴强;,八十三团“关爱农民工”多措并举重实效,兵团工运,2010,,1,38
邵忠新;,一八二团工会坚持以人为本构建和谐工会,兵团工运,2010,,1,39
韩玉芳;,“四一”制度为职工排忧解难,兵团工运,2010,,1,40
王娇萍;,维护工会主席权益是社会共同责任,工友,2010,,1,18-19
向德荣;,以党的十七届四中全会《决定》为指导 深化对工会理论和实践的认识,中国工运,2010,,1,8月10日
王洋;,工会工作社会化的探讨,中国工运,2010,,1,39-40
,各地工运信息,中国工运,2010,,1,59-60
李卫星;,强化基础促和谐 服务基层保稳定,农村.农业.农民(A版),2010,,1,42
罗棘;,村官新闻,农家顾问,2010,,1,17-18
刘永发;,顺义区总工会六项措施完善维权机制 深化服务理念,工会博览,2010,,1,12月13日
齐兆琳;,创新是做好工会工作的永续动力,天津市工会管理干部学院学报,2010,,4,21-23
任庆祥;,对非公企业劳资纠纷群体事件的若干思考,天津市工会管理干部学院学报,2010,,4,24-25
吴丽琼;,高等学校教育工会在加强教师队伍建设中的作用的思考,福建教育学院学报,2010,,6,34-36
丁爱梅;,工会组织如何在构建和谐社会中发挥积极作用,东方企业文化,2010,,18,118-119
范桂红;,从富士康跳楼事件谈新生代农民工权益的法律保护,中共郑州市委党校学报,2010,,6,51-52
邰伯红;,浅谈改善中小民营企业运营资金管理及对策,价值工程,2010,,35,94-95
石晓天;,农民工权益维护的路径分析及其出路,唯实,2010,,12,57-61
许敬;,强本创新是企业发展的不竭动力,科学之友,2010,,23,124-125
鲁芳;,维护职工合法权益 构建和谐劳动关系——《湖北省企业工会条例》解读,楚天主人,2010,,12,26-28
林朝晖;,完善女职工权益保护专项集体合同制度探析,北京市工会干部学院学报,2010,,4,28-31
赵建业;刘文莉;,发挥工会在国企改制中的作用,现代企业文化,2010,,12,86-87
柴强;,八十三团关爱农民工重实效,兵团工运,2010,,12,47
冉仁淑;,十团为拾花工开辟“绿色通道”,兵团工运,2010,,12,47
姚正卿;,试论新形势下国有企业的政工工作,厦门科技,2010,,6,49-51
王茹;李亚辉;,农民工劳动合同中存在的问题及原因分析,乌鲁木齐职业大学学报,2010,,4,33-36
,大视野,时代风采,2010,,12,6月7日
欧阳骏;,工会宏观参与的重要原则,工会理论研究(上海工会管理职业学院学报),2010,,6,4月6日
齐凌云;,社会转型期的中国工会组织:困境与改革,工会理论研究(上海工会管理职业学院学报),2010,,6,10-12+25
