Author-作者,Title-题名,Source-刊名,Year-年,Roll-卷,Period-期,PageCount-页码
郭文龙;,我国工会维权及“非对抗”原则内涵初探,工会理论研究(上海工会管理干部学院学报),2007,,3,"""16-18"""
黄瑞霖;,树立和落实工会维权观 确保职工队伍和工会组织团结统一,中国工运,2007,,6,"""15-16"""
冯占祥;,牢固树立工会维权观 在构建和谐社会中充分发挥工会组织作用,中国工运,2007,,6,"""17-18"""
张建民;,认真学习胡锦涛总书记重要讲话精神 树立和落实中国特色社会主义工会维权观 充分发挥工会组织在和谐社会建设中的重要作用——在2007年北京市工会领导干部理论研讨班上的讲话,工会博览,2007,,6,"""6-9"""
安立志;,认真学习维权观 深入贯彻维权观——学习中国特色社会主义工会维权观的体会,工会论坛(山东省工会管理干部学院学报),2007,,3,"""6-8"""
马云海;,要树立中国特色社会主义工会维权观,工会论坛(山东省工会管理干部学院学报),2007,,3,"""11-12"""
陈豪;,适应时代发展 建立完善党政主导的工会维权格局,中国工运,2007,,5,"""23-24"""
马启龙;,践行中国特色社会主义工会维权观 进一步开创国有企业工会工作新局面,中国工运,2007,,5,"""26-27"""
李红东;,职代会制度是工会维权的法宝,中国工运,2007,,5,"""46-47"""
,工会维权问题解答(十三),中国工运,2007,,5,"""52-54"""
,"维权,工会组织永恒的话题——学习中国特色社会主义工会维权观",中国职工教育,2007,,4,"""31-32"""
李会欣;,高校劳动关系的变化与工会维权机制的创新,西华大学学报(哲学社会科学版),2007,,2,"""31-33"""
陈豪;,建立和完善党政主导的工会维权格局,工会理论研究(上海工会管理干部学院学报),2007,,2,"""1-2"""
孙宝树;,论中国特色社会主义工会维权观,工会理论研究(上海工会管理干部学院学报),2007,,2,"""3-5"""
郭振清;,宪政视野中的中国特色社会主义工会维权观,中国特色社会主义研究,2007,,2,"""98-103"""
广西壮族自治区总工会课题组;,对新形势下建立和完善工会维权机制的思考,中国工运,2007,,4,"""31-33"""
,工会维权问题解答(十二),中国工运,2007,,4,"""51-53"""
马忠萍;,试谈工会维权的创新问题,兵团工运,2007,,4,"""10"""
曹峰旗;田芝健;,工会维权的复归与维权困境的政治学透视,江西行政学院学报,2007,,2,"""31-33"""
吴璇;陆继;,创新社会化维权机制 构建工会大维权格局,中国劳动关系学院学报,2007,,2,"""50-54"""
张存旭;,新形势下如何做好国有施工企业工会维权工作,军民两用技术与产品,2007,,3,"""48"""
孙登臣;,关于深化工会维权职能的思考,工会论坛(山东省工会管理干部学院学报),2007,,2,"""13-14"""
李明波;,牢固树立中国特色社会主义工会维权观 不断推进新时期工会维权工作的新发展,中国工运,2007,,3,"""8-10"""
郝敏;,让“关爱员工排行榜”成为工会维权的新载体,中国工运,2007,,3,"""49-50"""
,工会维权问题解答(十一),中国工运,2007,,3,"""52-54"""
樊临新;,"牢固树立工会维权观,在构建和谐社会中发挥作用",兵团工运,2007,,3,"""11"""
母泽林;,压力管理——工会维权的新亮点,工会理论研究(上海工会管理干部学院学报),2007,,1,"""21-24"""
曹峰旗;,工会维权的价值分析,工会理论研究(上海工会管理干部学院学报),2007,,1,"""25-28"""
张书华;,关于工会维权宣传的几点思考,新闻三昧,2007,,Z1,"""10-11"""
贝莉莉;,工人报宣传、落实工会“维权观”的实现路径,新闻三昧,2007,,Z1,"""12-15"""
张铁京;韩祥瑞;,主动·依法·科学——学习中国特色社会主义工会维权观的几点体会,新闻三昧,2007,,Z1,"""16-17"""
曹峰旗;,从政治生态看工会维权的政治文明意义,中共天津市委党校学报,2007,,1,"""87-89+94"""
平磊;,论坚持中国特色社会主义工会维权观,中国职工教育,2007,,2,"""42-43"""
陈曦;,加强工会维权能力建设初探,中国职工教育,2007,,2,"""44-45"""
,工会维权问题解答(十),中国工运,2007,,2,"""52-54"""
高爱萍;,完善工会维权机制,政工研究动态,2007,,2,"""44-45"""
杨静;彭茂全;,履行工会维权职责促进构建和谐社会,中国职工教育,2007,,1,"""50"""
吴锦良;,"“硬化”工会维权职能,构建和谐劳动关系——基于浙江劳动关系现状和工会工作的思考",中共浙江省委党校学报,2007,,1,"""27-32"""
王兆国;,坚持中国特色社会主义工会维权观 加强协调劳动关系 推动构建和谐社会──在全总十四届十一次主席团(扩大)会议上的讲话,中国工运,2007,,1,"""9-15"""
,工会维权问题解答(九),中国工运,2007,,1,"""53-55"""
钟开斌;,工会维权:中国矿难治理的战略举措,国家行政学院学报,2007,,1,"""102-105"""
谭立独;张鹤翔 ;谭美莲 ;庄世琼;,工劳合署 协力维权——恩施州巴东县野三关镇工会联合会维权纪实（下）,工友,2007,,12,"""26-28"""
万德毅 ;戴希彩;,云梦县村级工会登上维权舞台,工友,2007,,12,"""31"""
王金生;,在共建共享中发挥工人阶级和工会组织作用,中国工运,2007,,12,"""19-21"""
杨豫;,农民工维权:工会的困境与途径,法制与社会,2007,,12,"""680-681"""
李树年;,新时期工会女工维权的“三个必须”,中国职工教育,2007,,12,"""34+58"""
袁家雄;李焕荣;,用好工会经费 保证维权活动的开展,中国工会财会,2007,,12,"""18"""
张智青;,高校工会维权机制的建设,工会论坛(山东省工会管理干部学院学报),2007,,6,"""51-52"""
杨海风;,打破地域界限 兵地联动维权 一师阿拉尔市工会探索维护农民工权益新途径,兵团工运,2007,,11,"""42"""
钟渝;,高校教职工的不同利益诉求与工会组织的协调作用,高等建筑教育,2007,,4,"""162-164"""
梁勇;,做好项目部工会维权工作,企业文明,2007,,10,"""67-68"""
张丽;,工会女职工组织解决维权难问题初探,改革与开放,2007,,10,"""36-37"""
王连祥;,非公企业工会“维权”困境探析,工会理论研究(上海工会管理干部学院学报),2007,,5,"""19-21"""
刘景梅;,突出维权重点 提高维权能力 培养维权人才——一拖工会干部成为组织起来、切实维权的“律师”,中国职工教育,2007,,10,"""42"""
王华明;,人大《议案》是维权利器,工友,2007,,9,"""23-24"""
金丽君;,从源头上代表和维护,工友,2007,,9,"""18-19"""
潘兰英;,借力发力集维权之力,工友,2007,,9,"""21-23"""
蒋丽君;,医院工会如何在改革中维权,中山大学学报论丛,2007,,8,"""255-257"""
方丹;,以科学发展观为指导 推动落实中国特色社会主义工会维权观,中国工运,2007,,8,"""18-19"""
陈伶浪;,树立中国特色社会主义工会维权观 维护职工安全健康合法权益,中国工运,2007,,8,"""42-43"""
陈民;,加强企业工会工作与创新农民工双向维权的思考,决策探索(上半月),2007,,8,"""85"""
赵庆;张广文;,撑起农民工维权保护伞彰显人文工会妇联特色,兵团工运,2007,,8,"""37"""
汪集刚;,坚持科学维权观理论 开创工会工作新局面,中国职工教育,2007,,8,"""60-61"""
余明忠;柯晓华;,安陆市“维权漫画”在农民工中“漫游”,工友,2007,,7,"""20-21"""
,组织起来 切实维权 在和谐社会建设中充分发挥工会作用,中国工运,2007,,7,"""18-19"""
本刊评论员;,扛起工会维权的大旗,工会博览,2007,,7,"""1"""
,依法维权 和谐发展——上海索广电子有限公司工会工作剪影,工会理论研究(上海工会管理干部学院学报),2007,,3,"""48-49"""
郭振海;,关于工会科学维权工作的思考,中国劳动关系学院学报,2007,,3,"""57-59"""
,工会主席畅谈维权与和谐,工会博览,2007,,6,"""46"""
云秀梅;,落实中国特色社会主义工会维权观 坚持推动共建和谐共享和谐,中国工运,2007,,5,"""22-23"""
丁胜如;,加强工会维权机制建设的几点思考,中国工运,2007,,5,"""38"""
王书卿;闫红;司志通;,维护农民工权益要破解四个关键性问题,中国工运,2007,,5,"""44"""
方惠玲;谭劲松;,充分发挥工会在构建私企和谐劳资关系中的作用,浙江理工大学学报,2007,,3,"""303-307"""
余明忠;邱衍喻;,"县(市、区)工会工作专题之六 维权,就是要解决实际问题——武汉市武昌区总工会专访",工友,2007,,4,"""15-17"""
何强毅;,高校工会依法维权工作存在瓶颈的原因及对策,湖北经济学院学报(人文社会科学版),2007,,4,"""98-100"""
杨萍;,完善维权机制 发挥维权作用,兵团工运,2007,,4,"""26"""
苗笑寒;,工会维权要抓好“五靠”,决策探索(上半月),2007,,4,"""31"""
曾传俊;,浅谈高校工会如何履行维权职能,科技信息(学术研究),2007,,10,"""50"""
胡传荣;,关于建立和完善工会社会化维权机制的理性思考,北京市工会干部学院学报,2007,,1,"""17-19"""
李晓玉;,关于加强我国工会建设的思考,法制与社会,2007,,3,"""642-643"""
赵健杰;,论工会社会化维权——以大连开放先导区总工会维权为例,天津市工会管理干部学院学报,2007,,1,"""6-8+22"""
刘自崧;,构建和谐社会环境条件下工会做好维权工作的途径,工会论坛(山东省工会管理干部学院学报),2007,,2,"""53"""
彭进;,浅谈企业工会如何提高维权执行力,中国职工教育,2007,,3,"""45"""
骆小骏;周松强;,在政府和农民工之间:市场经济下工会双重身份的平衡——以义乌市总工会“社会化维权”制度为例,中共浙江省委党校学报,2007,,2,"""100-105"""
高宏峰;,团结动员广大职工为构建和谐民航做出新贡献,中国工运,2007,,3,"""22"""
彭迪;,对改制企业工会组织现状及维权问题的思考,兵团工运,2007,,3,"""22"""
王继明;,北京液化石油气公司工会实行源头参与维权作用大,工会博览,2007,,3,"""18"""
张峰;马凌;,SA8000标准：构建和谐劳动关系及制度优化——基于博弈理论视角,职业圈,2007,,23,"""70+73"""
本刊评论员;,切实承担起宣传中国特色社会主义工会维权观的重大职责,新闻三昧,2007,,Z1,"""1"""
范瑞先;,工人日报维权报道的特色,新闻三昧,2007,,Z1,"""5-8"""
丁秀胤;范晓中;,职工维权的媒体表达,新闻三昧,2007,,Z1,"""8-9"""
吴秀梅;,施工企业创建和谐劳动关系中工会怎样维权,安装,2007,,2,"""17-19"""
孙宝树;,认真学习和牢固树立中国特色社会主义工会维权观,中国工运,2007,,2,"""8-12"""
杨自华;,农三师工会成立困难职工维权(帮扶)机构,兵团工运,2007,,2,"""28"""
杨萍;,工会维权求实效,兵团工运,2007,,2,"""29"""
李卫东;杜克建;,以民主议事会为载体 切实维护职工合法权益——农四师七十七团工会维权工作情况介绍,兵团工运,2007,,2,"""36"""
王慧民;,工会在企业职工工资收入分配中的维权作用,中国劳动关系学院学报,2007,,1,"""53-56"""
吴小玲;李胜杰;,高校工会要做好维权工作,学习月刊,2007,,2,"""111"""
李滨生;,充分认识坚持中国特色社会主义工会维权观的重大意义,中国工运,2007,,1,"""1+26"""
秦鲁隼;,正确把握工会维权观的基本内涵,中国工运,2007,,1,"""27"""
新雪;,聚焦中国特色社会主义工会维权观,工会博览,2007,,1,"""8"""
董晓颖;,谈高校工会的维权职能,辽宁师专学报(社会科学版),2007,,6,"""124-126"""
李晓慧;周文;,湘鄂赣毗邻16县(市)工会共商维权合作大计,工友,2007,,12,"""69"""
熊必军;,论构建社会主义和谐劳动关系,湖南省社会主义学院学报,2007,,6,"""52-53"""
,来稿摘登,中国工运,2007,,12,"""57-58"""
李朝晖;,论农民工工伤风险保障运行模式的构建,经济问题探索,2007,,12,"""103-106"""
杨琳;,工会：职工权益的权威维护者——专访中华全国总工会副主席、书记处第一书记孙春兰,瞭望,2007,,48,"""38-39"""
鹿宏伟;,要加强新形势下工会的维权职能,兵团工运,2007,,10,"""14"""
易实发;,农一师阿拉尔市工会狠抓农民工维权工作,兵团工运,2007,,10,"""18"""
汪建然;,上海建筑业农民工工会的组建和维权,工会理论研究(上海工会管理干部学院学报),2007,,5,"""27-28"""
,德化县以开展规范化建设促基层经审工作,中国职工教育,2007,,10,"""62"""
李静;,充分发挥工会女职工组织在维权机制建设方面的作用,学习论坛,2007,,9,"""45-46"""
薛洪源;,以人大为舞台,工友,2007,,9,"""21"""
贺斌生;,网络环境下高校工会工作新探,北京市工会干部学院学报,2007,,3,"""25-28"""
谭立独;徐善洪;徐臣鄂;,农民工:有多少病痛可以承受?,工友,2007,,9,"""12-16"""
方建洲;,用活用足人大执法检查权,工友,2007,,9,"""19-20"""
,基层动态,中国工运,2007,,9,"""59-60"""
王映山;孔德懿;,工会切实为农民工维权,兵团工运,2007,,9,"""46"""
,破解非正规化就业农民工维权难题的有益探索——关于大连·信阳(新县)进城务工人员工会联合会的调研报告,红旗文稿,2007,,17,"""29-32"""
时喜敏;,对提高工会组织内部工作效率的思考,中国职工教育,2007,,9,"""58-59"""
,探索行业民主管理模式 提高工会整体维权水平,上海企业,2007,,8,"""13-15"""
杨文华;,引导职工群众学法守法用法,兵团工运,2007,,8,"""23"""
王颖;,手托“两家”促维权——访北京市总工会制造业工委主任、市国防工业工会主席罗峰,工会博览,2007,,8,"""13-14"""
陈全武;王永忠;,浅谈新形势下工会的维权工作,江西煤炭科技,2007,,3,"""62-63"""
,正确认识和处理好“五个关系” 努力推动和谐社会建设,中国工运,2007,,7,"""21-22"""
王新雨;,集体合同履行难原因浅析,天津市工会管理干部学院学报,2007,,2,"""29-31"""
杨梅蓉;,完善维权机制 维护职工合法权益,理论学习,2007,,6,"""36"""
张毓余;,畅通诉求渠道 完善表达机制 努力实现主动维权,中国工运,2007,,6,"""18-19"""
杨月英;,提高工会干部的维权帮困能力,兵团工运,2007,,6,"""13"""
宋艳慧;,工会的行政诉讼原告资格研究,中国劳动关系学院学报,2007,,3,"""69-72"""
高文斌;,街道工会是维权“桥头堡”,工友,2007,,5,"""13"""
,以发展和谐劳动关系为主线 大力开展创建劳动关系和谐企业活动,中国工运,2007,,5,"""25-26"""
李战胜;,站在维权第一线——记全国工会系统“四五”普法先进个人闫玉民,兵团工运,2007,,5,"""22"""
林宗弘;,台湾工会三部曲:维权、自主、全球化,南风窗,2007,,9,"""38-39"""
杨玉清;,坚持中国特色工会的维权观切实履行工会的基本职责,中国职工教育,2007,,4,"""33-34"""
王洪;,如何坚持中国特色维权观,工会理论研究(上海工会管理干部学院学报),2007,,2,"""8-10"""
曾晓明;,防止新闻侵权的三副盾牌,新闻三昧,2007,,4,"""6-9"""
散襄军;,充分发挥工会在社会主义和谐社会建设中维护职工合法权益的作用,中国工运,2007,,4,"""18-19"""
邓一刚;,打工期间苯中毒 工会替打工妹维权,农家科技,2007,,4,"""42"""
徐夫征;,解读科学维权,天津市工会管理干部学院学报,2007,,1,"""2-5+20"""
张成富;,以发展和谐劳动关系为主线 在建设和谐社会中再创辉煌,中国工运,2007,,3,"""24"""
张怡军;,求真务实 真抓实干 努力开创农三师工会工作新局面,兵团工运,2007,,3,"""9"""
景俊;,树立维权观 建功“十一五” 发挥工会在构建社会主义和谐社会中的作用,兵团工运,2007,,3,"""11"""
马燕;,维权的工会才有生命力,兵团工运,2007,,3,"""27"""
罗荣;,二十九团工会着力构建“和谐团场”,兵团工运,2007,,3,"""29"""
,全总经审会办公室2007年工作安排要点,中国工会财会,2007,,3,"""6-7"""
蒋建勋;,发展和谐劳动关系 维护职工合法权益 团结动员广大职工为构建和谐兵团建功立业——兵团工会主席蒋建勋同志在兵团工会四届二次全委(扩大)会议上的工作报告摘要,兵团工运,2007,,2,"""8-11"""
林双川;,聚焦中国工会新“维权观”,人民政坛,2007,,2,"""28-29"""
高鹏;彭静雯;谭亮;,农村中小学教师维权保障机制中乡镇教育工会的职能调整研究,安徽农业科学,2007,,3,"""855-856"""
张春旺;,坚持党政主导、工会运作的维权格局,中国工运,2007,,1,"""32"""
郭宏;,工会组织如何体现维权的基本职责,兵团工运,2007,,1,"""10"""
王建军;,深入系统学习 联系实际运用 为建设和谐小康社会发挥主力军作用,兵团工运,2007,,12,5
邵学东;,工会维权要有可为,兵团工运,2007,,12,15
王慧民;,试论工会是劳动关系协调机制的组织基础,中国劳动关系学院学报,2007,,6,16-19
戴建荣;夏厚勋;,试论做好工会工作与建立和谐劳动关系的关系,工会论坛(山东省工会管理干部学院学报),2007,,6,12月13日
闫玉民;,以十七大精神为动力 推进工会工作创新发展,兵团工运,2007,,11,8
林政兵;,服务社区经济发展,工友,2007,,10,20-21
郭苏智;,和谐视阈下高校工会工作创新初探,工会理论研究(上海工会管理干部学院学报),2007,,5,41-42
黄明;,非公企业工会主席产生机制的创新之举——吉林省在非公企业全面推行工会主席社会化职业化纪实,中国职工教育,2007,,10,58+37
张庆莲;,强化工会财务管理之我见,中国工会财会,2007,,10,14
孙茜;,提高工会财务工作水平 实现规范化管理,中国工会财会,2007,,10,30-31
吴亚平;郑桥;,从国际比较的视野看中国工会的特点和发展趋势,中国劳动关系学院学报,2007,,5,68-72
邹绿叶;,工会经费代收尚需从五个方面着力,工友,2007,,9,17
张琦;,我国的工会法律制度及其完善,安徽职业技术学院学报,2007,,3,29-31
,中华全国总工会关于进一步加强国有企业改制和关闭破产中工会工作的意见,中国工运,2007,,9,20-21
刘杰霞;,强化基层工会财务管理之我见,中国工会财会,2007,,8,12月13日
曲延志;杨军;,马克思主义工会学说中国化的最新成果,中国劳动关系学院学报,2007,,4,4月7日
李一平;,工会协调非公有制企业劳资关系:困境、症结及对策,中共浙江省委党校学报,2007,,4,27-32
董林;,过去帮人“说好话” 如今替人“打官司”——3年替农民工打了633场官司索赔2200万元,工友,2007,,7,12月13日
吴松;,关于增强基层工会活力的几点思考,职业圈,2007,,10,10+12
李放;,新时期工会的战略转型与党的执政基础,中共福建省委党校学报,2007,,7,67-70
白志明;,建立健全工作机制有效维护职工合法权益,中国职工教育,2007,,7,42-43
夏延芳;,农民工问题研究综述,现代农业科技,2007,,12,165-166+169
张丽;,对当前职工关注热点问题的调查与思考,北京市工会干部学院学报,2007,,2,16-19
,坚持以职工为本努力为职工办好事实事,中国工运,2007,,6,14-15
张杰;,工会维权重在为员工办实事,兵团工运,2007,,6,13
李放;,走向谈判的工会:党巩固阶级基础的政治架构,中国劳动关系学院学报,2007,,3,1月6日
孟燕华;,工会主动参与劳动安全卫生工作机制的研究,中国劳动关系学院学报,2007,,3,60-64
颜江伟;,行政化与回归社会:中国工会体制的弊病与改革,中共浙江省委党校学报,2007,,3,29-34
王水官;,浅谈主动依法科学维权的“三性”,工会理论研究(上海工会管理干部学院学报),2007,,2,6月8日
,全总召开研讨会学习贯彻中央领导同志重要批示精神,中国工运,2007,,4,29
,本刊近期宣传要点及用稿要求,中国工运,2007,,4,62
郭振海;,论工会工作理论创新的方法和途径,中国劳动关系学院学报,2007,,2,55-56
武玉珠;,加深对工会“三维权”的认识,天津市工会管理干部学院学报,2007,,1,9月10日
朱爱武;,企业社会责任的落实与中国工会的应对策略,工会论坛(山东省工会管理干部学院学报),2007,,2,6月8日
谷常生;,以社会主义核心价值体系为根本努力推动工会宣教工作取得新的进展——在全国工会宣教工作座谈会上的讲话(摘要),中国职工教育,2007,,3,7月8日
,全总出台意见进一步推进女职工权益保护专项集体合同工作,中国工运,2007,,3,13
蒋厚兰;,创“维权”品牌构建和谐劳动关系,中国工运,2007,,3,38
王德法;,围绕大局工作 贴近基层服务,兵团工运,2007,,3,10
骆志胜;,以建设“四会”为目标彰显工会的生机与活力,中国职工教育,2007,,2,58-59
常雨琴;,常雨琴散文连载之一 麦田守望者之歌,工友,2007,,2,58-59
周爱萍;,依法维权 坚持“四个强化”,兵团工运,2007,,2,31
新雪;,2006年工会新闻览要,工会博览,2007,,2,4月5日
王静;,我国推行平等协商和集体合同制度存在问题及对策研究,新乡教育学院学报,2007,,1,"""8-10"""
李永伟;,以人为本开展竞赛 科学组织切实维权,太原理工大学学报(社会科学版),2007,,S1,13-14
孙守权;,关于工会参与构建和谐社会的工作思考,天津市工会管理干部学院学报,2007,,4,8月11日
徐夫征;,构建和谐劳动关系机制的研究,天津市工会管理干部学院学报,2007,,4,3月7日
董晓颖;,谈高校工会的维权职能,辽宁师专学报(社会科学版),2007,,6,124-126
王武金;,新时期工会维权问题探讨,中共郑州市委党校学报,2007,,6,60-61
杨琳;张军;秦亚洲;,社会政策“软腿”多,瞭望,2007,,51,31-32
四川省总工会课题组;,论工会组织在建设社会主义核心价值体系中引导作用的发挥,成都理工大学学报(社会科学版),2007,,4,113-116
陈晓云;,交互性沟通:新时期劳动关系三方协调模式,经济导刊,2007,,12,105-107
赵俊保;,对当今工会直属企事业发展战略的思考,北京市工会干部学院学报,2007,,4,20-23
郭庆;,试论在共建共享和谐社会中工会组织的四个作用,北京市工会干部学院学报,2007,,4,3月6日
谭立独;张鹤翔 ;谭美莲 ;庄世琼;,工劳合署 协力维权——恩施州巴东县野三关镇工会联合会维权纪实（下）,工友,2007,,12,26-28
火淼;段善玺;,青山区非公企业工会联合会主席“公选直管”已运作周年,工友,2007,,12,30
万德毅 ;戴希彩;,云梦县村级工会登上维权舞台,工友,2007,,12,31
李晓慧;周文;,湘鄂赣毗邻16县(市)工会共商维权合作大计,工友,2007,,12,69
熊必军;,论构建社会主义和谐劳动关系,湖南省社会主义学院学报,2007,,6,52-53
曹利军;,加强机关事业单位工会组织规范化,科学之友(B版),2007,,12,80-81
包秦;,坚持用科学发展观统领工会工作 走中国特色社会主义工会发展道路,中国工运,2007,,12,4月6日
黄国庆;,认真学习贯彻党的十七大精神 在推进中国特色社会主义事业中发挥工会组织的作用,中国工运,2007,,12,6月8日
,以党的十七大精神为指导 进一步开创工会工作的新局面,中国工运,2007,,12,9月10日
王金生;,在共建共享中发挥工人阶级和工会组织作用,中国工运,2007,,12,19-21
,积极推进区域、行业工资协商机制建设,中国工运,2007,,12,22-24
,来稿摘登,中国工运,2007,,12,57-58
,各地工运信息,中国工运,2007,,12,59-60
本刊编辑部;,扎实开展创建“工人先锋号”活动,兵团工运,2007,,12,1
程灵芝;,用十七大精神武装工会妇联干部头脑 不断开创工会工作的新局面,兵团工运,2007,,12,5
王建军;,深入系统学习 联系实际运用 为建设和谐小康社会发挥主力军作用,兵团工运,2007,,12,5
董彩屏;,以党的十七大精神为指导 推动工会工作创新发展,兵团工运,2007,,12,8
郭光琴;,学习十七大精神 探索新时期基层工会工作新途径,兵团工运,2007,,12,9
徐广媛;,学习贯彻十七大精神 不断探索团场工会工作新思路,兵团工运,2007,,12,12
邵学东;,工会维权要有可为,兵团工运,2007,,12,15
刘建疆;,当前国有企业工会工作面临的问题及对策,兵团工运,2007,,12,17
谭必元;,港澳社区工会工作的启示,工会理论研究(上海工会管理干部学院学报),2007,,6,44-45
陈豪;,深入学习贯彻党的十七大精神 努力开创上海工会工作新局面,工会理论研究(上海工会管理干部学院学报),2007,,6,1月5日
吴红星;,落实工会维权观 坚持“五个相统一”,工会理论研究(上海工会管理干部学院学报),2007,,6,24-25
严爱科;,以“点圈链”模式推进劳动关系和谐企业创建,工会理论研究(上海工会管理干部学院学报),2007,,6,26-28
黄春梅;,健全帮困体系、创新求助载体的实践,决策探索(上半月),2007,,12,58-60
杨豫;,农民工维权:工会的困境与途径,法制与社会,2007,,12,680-681
白莲;,论中国特色社会主义工会维权观,太原城市职业技术学院学报,2007,,6,23-24
史维芳;张宝;陈文恩;,关于坚持树立中国特色的工会维权观的思考与探索,科技信息(学术研究),2007,,34,61
吴昌元;,以科学发展观为指导 开创人大内务司法工作新局面,海南人大,2007,,12,8月11日
毛大方;,维护聘用员工合法权益 促进医院和谐发展,中国职工教育,2007,,12,35-36
吉文;,学习贯彻十七大精神 开创工会工作新局面,中国职工教育,2007,,12,1
李树年;,新时期工会女工维权的“三个必须”,中国职工教育,2007,,12,34+58
,衢州市财政局 中国人民银行衢州市中心支行 衢州市地方税务局 衢州市总工会关于完善工会经费征收管理工作的通知,中国工会财会,2007,,12,59-60
